{
  "$schema": "https://json-schema.org/draft/2020-12/schema",
  "$id": "https://harness.tcbs.vn/schemas/test-case/v1",
  "title": "Test Case Metadata",
  "description": "Metadata for each test case produced by the Test-Implementer alongside test code. The harness uses it to verify traceability and route failures.",
  "type": "object",
  "additionalProperties": false,
  "required": ["id", "condition_id", "requirement_id", "technique", "priority", "test_class", "test_method", "preconditions", "steps", "expected"],
  "properties": {
    "id": {
      "type": "string",
      "pattern": "^TC-[A-Z]+-\\d{4}$"
    },
    "condition_id": {
      "type": "string",
      "pattern": "^TCON-[A-Z]+-\\d{4}$",
      "description": "The test-plan condition implemented by this case"
    },
    "requirement_id": {
      "type": "string",
      "pattern": "^(REQ-[A-Z]+-\\d{3}|INV-[A-Z]+-\\d+)$",
      "description": "Cites either a REQ- requirement id or an INV-<AREA>-<N> design invariant id; test cases may trace whichever identifier family the approved design produced."
    },
    "technique": {
      "enum": ["property", "decision_table", "mcdc", "boundary_value", "equivalence_partition", "state_transition", "example", "contract", "e2e_scenario", "jcstress", "deterministic_replay", "fuzzing", "regression_from_property"]
    },
    "property_kind": {
      "enum": ["invariant", "round_trip", "model_based", "metamorphic", "field_sensitivity", "algebraic"],
      "description": "Required when technique = property; forbidden otherwise"
    },
    "origin_seed": {
      "type": "string",
      "maxLength": 100,
      "description": "Only for regression_from_property: jqwik seed from the original failure"
    },
    "priority": {
      "enum": ["P0", "P1", "P2"]
    },
    "test_class": {
      "type": "string",
      "pattern": "^[a-zA-Z_$][a-zA-Z\\d_$]*(\\.[a-zA-Z_$][a-zA-Z\\d_$]*)*$",
      "description": "Test class FQCN"
    },
    "test_method": {
      "type": "string",
      "pattern": "^[a-zA-Z_$][a-zA-Z\\d_$]*$"
    },
    "preconditions": {
      "type": "array",
      "items": { "type": "string", "maxLength": 300 }
    },
    "steps": {
      "type": "array",
      "minItems": 1,
      "items": { "type": "string", "maxLength": 500 }
    },
    "expected": {
      "type": "object",
      "additionalProperties": false,
      "required": ["assertion_kind", "description"],
      "properties": {
        "assertion_kind": {
          "enum": ["state", "return_value", "event_emitted", "exception", "property_holds"]
        },
        "description": {
          "type": "string",
          "minLength": 10,
          "maxLength": 500
        }
      }
    }
  },
  "allOf": [
    {
      "if": { "properties": { "technique": { "const": "property" } } },
      "then": { "required": ["property_kind"] },
      "else": { "not": { "required": ["property_kind"] } }
    },
    {
      "if": { "properties": { "technique": { "const": "regression_from_property" } } },
      "then": { "required": ["origin_seed"] }
    }
  ]
}
