{"id":"TC-JOURNEY-0003","condition_id":"TCON-JOURNEY-0003","requirement_id":"INV-CORR-1","technique":"e2e_scenario","priority":"P0","test_class":"tests.k8s.KubernetesDiagnosticContextJourney","test_method":"targetRunNeverReturnsDecoyContext","preconditions":["Target and decoy records have distinct markers and run ids."],"steps":["Emit overlapping target and decoy records.","Query only the target run through MCP."],"expected":{"assertion_kind":"property_holds","description":"The target marker is returned and no decoy marker, run id, or namespace is returned."}}
