{"id":"TC-JOURNEY-0006","condition_id":"TCON-JOURNEY-0006","requirement_id":"INV-BOUND-1","technique":"e2e_scenario","priority":"P0","test_class":"tests.k8s.KubernetesDiagnosticContextJourney","test_method":"downstreamStallTerminatesAtServerDeadline","preconditions":["The deployed storage path can be made unavailable in the disposable namespace."],"steps":["Stop the namespace-local OpenSearch workload.","Issue an authenticated MCP request under an independent watchdog."],"expected":{"assertion_kind":"property_holds","description":"The server fails near five seconds and the independent watchdog terminates the test by twelve seconds."}}
