{"id":"TC-JOURNEY-0002","condition_id":"TCON-JOURNEY-0002","requirement_id":"INV-REDACT-1","technique":"e2e_scenario","priority":"P0","test_class":"tests.k8s.KubernetesDiagnosticContextJourney","test_method":"secretsAreAbsentFromRetrievedContext","preconditions":["Message and attribute secrets are configured for redaction."],"steps":["Emit a safe marker with distinct message and attribute secrets.","Retrieve the record through MCP."],"expected":{"assertion_kind":"property_holds","description":"The safe marker is present and neither original secret occurs in the response."}}
