{"id":"TC-JOURNEY-0009","condition_id":"TCON-JOURNEY-0009","requirement_id":"INV-JOURNEY-1","technique":"contract","priority":"P0","test_class":"tests.k8s.KubernetesDiagnosticContextJourney","test_method":"nodeLogDenialIsReportedAsA006Checkpoint","preconditions":["An authorized disposable Kubernetes cluster is selected."],"steps":["Emit a node-visible fixture marker.","Wait a bounded period for collector-backed MCP observability."],"expected":{"assertion_kind":"return_value","description":"Failure to observe the marker exits as the distinct A-006 environment checkpoint, never a skip or pass."}}
