{"id":"TC-JOURNEY-0004","condition_id":"TCON-JOURNEY-0004","requirement_id":"INV-BOUND-1","technique":"e2e_scenario","priority":"P0","test_class":"tests.k8s.KubernetesDiagnosticContextJourney","test_method":"overBudgetResultIsBoundedAndTruncatedWithoutPagination","preconditions":["More than 200 matching records serialize beyond 256 KiB."],"steps":["Query the matching interval through authenticated MCP.","Measure the public response and inspect truncation metadata."],"expected":{"assertion_kind":"property_holds","description":"At most 200 records and 256 KiB are returned with truncation and without a cursor."}}
