{"id":"TC-JOURNEY-0001","condition_id":"TCON-JOURNEY-0001","requirement_id":"INV-JOURNEY-1","technique":"e2e_scenario","priority":"P0","test_class":"tests.k8s.KubernetesDiagnosticContextJourney","test_method":"optedInMarkerIsReturnedWithKubernetesAndRunContext","preconditions":["An authorized disposable Kubernetes test cluster is selected."],"steps":["Deploy the stack and emit a unique opted-in correlated log.","Retrieve failure context through authenticated MCP."],"expected":{"assertion_kind":"return_value","description":"MCP returns the marker, Kubernetes identity, observed timestamp, and exact test run id."}}
