{"id":"TC-JOURNEY-0008","condition_id":"TCON-JOURNEY-0008","requirement_id":"INV-JOURNEY-1","technique":"e2e_scenario","priority":"P0","test_class":"tests.k8s.KubernetesDiagnosticContextJourney","test_method":"namespaceCleanupIsTrappedAndBounded","preconditions":["Every run owns a uniquely named disposable namespace."],"steps":["Exit through success, assertion failure, or watchdog handling.","Poll for namespace absence under the cleanup deadline."],"expected":{"assertion_kind":"state","description":"The namespace becomes absent within sixty seconds or cleanup fails loudly with its name."}}
