{"id":"TC-JOURNEY-0005","condition_id":"TCON-JOURNEY-0005","requirement_id":"INV-BOUND-1","technique":"contract","priority":"P0","test_class":"tests.k8s.KubernetesDiagnosticContextJourney","test_method":"intervalOverFifteenMinutesIsRejected","preconditions":["The authenticated MCP endpoint is ready."],"steps":["Submit a search interval longer than fifteen minutes."],"expected":{"assertion_kind":"return_value","description":"The public MCP response rejects the interval instead of executing, widening, or clipping it."}}
