{"id":"TC-JOURNEY-0007","condition_id":"TCON-JOURNEY-0007","requirement_id":"INV-READ-1","technique":"e2e_scenario","priority":"P0","test_class":"tests.k8s.KubernetesDiagnosticContextJourney","test_method":"clientCanUseOnlyAuthenticatedMcp","preconditions":["The journey client uses its scoped Kubernetes ServiceAccount."],"steps":["Prove the identity cannot read pod logs or secrets.","Retrieve context through the MCP-only egress policy."],"expected":{"assertion_kind":"property_holds","description":"MCP retrieval succeeds without pod-log permission, OpenSearch credentials, or direct store access."}}
